key,0,1,2,3,4,5
104,"A red-scaled trout commonly found in the rivers originating on Abalathia's Spine. The color of its scales led past generations to believe that the wavekin fed on the blood of other fish. The theories of the current generation, however, are just as nonsensical, the most popular being that the crimson trout is a servant of Dalamud.",4986,40,2,155,True
105,"A colorful freshwater fish that can only survive in rivers located in more temperate climes. Though there is no proof, most believe that the fish was introduced to Eorzean waters by foreign traders from the south.",4987,40,2,137,True
106,"This sand-dwelling slug is able to maintain its mucous coating by absorbing the moisture from prey it catches at the bottom of conical pits not unlike the ones antlions are known to dig. A famous author once wrote a novel (that he claimed was based on fact) in which antlion slugs were actually intelligent rulers of an underground kingdom.",5036,40,4,146,True
107,"A piece of sharp coral, rarely found in any of Eorzea's five seas. The material is so rare, in fact, that it often fetches prices similar to those asked for garnets or rubies.",5462,40,0,138,True
108,"This species of trout was once only found in Vylbrand's Bronze Lake. Naturalists attribute the spread of the wavekin into nearby rivers and ponds to birds who will catch Bronze Lake trout from the eponymous lake, only to let the fish fall from their talons when carrying them back to their nests.",4988,41,3,139,True
109,"The fiery red shells of this freshwater snail, also known as ""Ifrit's claws,"" are prized by the Amalj'aa, and are useful when bartering with the beast tribe.",4989,41,3,156,True
110,"Remarkably smooth skin allows the dune manta to glide through desert sands as though they were ocean waters. Its massive wings are used to envelop and smother its prey, which it then slowly devours with a tiny mouth that belies the actual size of the creature.",5037,41,4,146,True
111,"A large, spindle-shaped shark commonly found in the Sea of Ash and known to attack much larger prey─such as fishers and sailors─without provocation.",4903,41,1,134,True
112,"This variety of striped freshwater fish earns its name from its tendency to gather by the legs of any man or beast who enters its habitat. Ul'dahns, on the other hand, will oft refer to the selfsame fish as the ""royal pleco,"" claiming that it received its name when a merchant presented the former sultan Sasabaru one at his coronation.",4990,42,3,145,True
113,"A rare freshwater fish decorated with a thunderbolt-like pattern down its back. The Keepers of the Moon who inhabit the Black Shroud will eat one of these before a big hunt, claiming that it grants them speed and strength.",4991,42,2,180,True
114,"Fall jumpers are born with an inherent tendency to swim against the current. When they arrive at a falls, this leaves them with no option but to leap out of the water in an attempt to continue upstream. Some Ishgardians believe this ability was granted the fish when a drop of blood from a wounded dragon fell into a Coerthas river and was swallowed by a trout.",4992,43,2,152,True
115,"The freshwater knifefish is named such due to its resemblance, both in shape and color, to a flat blade. Unlike a knife, however, this wavekin is as sharp as a pumpkin, and has been known to swim right out of the water, only to suffocate on shore.",4993,43,2,145,True
116,"A razor-fanged saltwater fish known to migrate throughout the warm waters of the Sea of Ash, following the schools of shrimp on which it feeds. While not considered a delicacy, the wahoo is treasured amongst alchemists who employ the bones and scales in several different medicines.",4904,43,1,138,True
117,"This deep blue freshwater fish can be seen sticking its head out of the water whenever it rains, leading people to believe it is the fish summoning the storm. However, naturalists have surmised that the fish are simply rising to the surface in search of food, mistaking the drops of water for insects.",4905,43,2,133,True
118,"A giant freshwater fish found in inland lakes and rivers. Its name is derived from its resemblance to a knotty oaken root.",4994,44,2,154,True
119,"Found across Eorzea, this freshwater fish has highly developed fins and spines which not only protect the wavekin, but serve as weapons for hunting its prey which includes insects and other creatures.",4995,44,2,139,True
120,"This bivalved mollusk was once as abundant in Eorzean waters as its white-lipped cousin. However, overfishing by Ul'dahn jewelers searching for black pearls has seen blacklip oyster numbers drop almost to zero.",5466,44,0,138,True
121,"Though classified as a freshwater fish native to the Velodyna and Hathoeva rivers, this particular wavekin can survive in the brackish delta where the waterways spill into the Sea of Jade. The southern pike will eat almost anything that will fit in its mouth, including fish, shells, frogs, even squirrels and birds.",4996,45,2,153,True
122,"Though classified as a freshwater fish native to the White Maiden, this particular wavekin can survive in the brackish waters where the Maiden meets the Strait of Merlthor. The only difference between the northern pike and its cousin, the southern pike, is the color of their tails─the northern's being red, the southern's blue.",4997,45,2,155,True
123,"Similar to the spotted puffer, the kobold puffer can also survive in the brackish waters of deltas and river mouths. Its spots, however, are replaced with a hideous coat of bristly spines which give it the appearance of a bedraggled kobold.",4998,45,2,137,True
124,"A giant cephalopod characterized by its spectacular whorled shell. Commonly found in the nutrient-rich Bay of Dha'yuz, the wavekin are thought by sailors and pirates to be the heralds of the Navigator, Llymlaen, and their shells are often carved into celebratory chalices.",4906,45,0,138,True
125,"When feeding, the archerfish will lift its head ever so slightly above a lake or river's surface and spit a stream of water up to a yalm to strike flies from low-lying branches into the water with remarkable accuracy.",4999,45,3,137,True
126,"Cloud jellyfish aimlessly drift about the Sea of Clouds, tentacles spread out below them, searching for the small birds on which they feed. Naturalists conclude that the creatures are able to stay aloft by heating the air trapped inside their bodies, making it lighter than the surrounding winds.",5038,45,5,155,True
127,"The goblins claim that they brought this variety of perch back from their years-long pilgrimage into Othard and Ilsabard...because it tasted so divine.",5000,46,2,153,True
128,"A rare species of carp that only can be found in the Agelyss River─so rare, in fact, that the smallfolk believe that even seeing one can bring seven days of good fortune to one's family.",5001,46,2,137,True
129,"When stretched straight from head to tail, the longest of saltwater pike eels can measure more than a full yalm in length─or, the length of an average pike.",4907,46,1,138,True
130,"A violent species of freshwater fish from central Abalathia's Spine that will attack other fish if they draw too near while feeding.",5002,47,3,156,True
131,"Similar to its cousin the mudskipper, the sludgeskipper can also survive outside water for several bells. The sludgeskipper, however, is at home in highly polluted pools where other creatures would likely perish.",5003,44,3,147,True
132,"One of the more common creatures found living on the thermal currents above the Sea of Clouds, from a distance, the skyfish appears to be no more than a simple rod outfitted with three sets of transparent wings.",5039,47,5,155,True
133,"This saltwater fish's name comes from the odd lump on its head, thought to resemble a mummer's motley cap. During mating season, adult males will butt their heads continuously until a female selects which she concludes has the hardest lump.",4908,47,1,138,True
134,"The swiftest inhabitants of the Sea of Clouds, cloud cutters will fly straight in a single direction for malms before quickly turning at some unthinkable angle and darting off in another direction. On rare occasions, they have been known to puncture the armor plating of airships.",5040,48,5,155,True
135,"This freshwater anomaly possesses high concentrations of lightning-aspected aetherial energy which can be used to inflict serious injury on any foolish enough to provoke the fish.",5004,48,3,156,True
136,"A hard-scaled freshwater fish native to southern Eorzea. The garpike is mentioned in the famous Raimdelle Codex, where it is described as a thirty-yalm monstrosity with two score hundred teeth and arms like a goobbue's. Fortunately for us, the garpike of Raimdelle's time is no more.",5005,48,3,147,True
137,"The blind manta is thought to navigate the Sea of Clouds in a manner similar to how bats keep their bearings─using sound and echoes to determine the location of cliff faces and other creatures.",5041,48,5,155,True
138,"A bottom-feeding flatfish, the plaice is most commonly found blending into the sands covering the sea floor near the Isles of Umbra, where, rather than pursuing its own prey, it waits for an unsuspecting fry to happen by.",4909,48,0,138,True
139,"Unlike its Eorzean cousins, the Ilsabardian bass is mean-tempered and quick to bite, attacking other species sharing the same lake until there are none left but its own. Ill luck is said to come to all who gaze into its deep red eyes.",5006,48,3,156,True
140,"A brightly colored fish native to the warm waters in and around the Amalj'aa territory of Paglth'an. The fact that the wavekin has been spotted in locations distant from their stronghold has led Ul'dahn officials to worry that the beast tribe may be seeding other rivers and lakes with the fish in preparation for the Amalj'aa's advancement into those lands.",5007,49,2,146,True
141,"The largest pleco known to naturalists, this variety is known for violently flailing its fins and ramming its head into any unfortunate creature that happens to swim by, especially during the spawning season.",5008,49,2,153,True
142,"The rift sailor uses the light elastic webbing between its aetherially charged wings to catch the roiling winds of the Sea of Clouds and glide across the rifts. Spying one dart across your path is often regarded as an omen of good fortune.",5042,49,5,155,True
143,"Legends tell of giant sea devils emerging from the sea to wrap their many arms around ships and drag them to the abyss. This seems impossible today, as the largest catches in recent memory are little more than a yalm across.",4910,49,0,138,True
144,"Native to the freshwater rivers of Abalathia's Spine, the kissing trout is famous for its mating ""dance"" in which a male and female will face each other for several moments before proceeding to couple.",5009,50,2,155,True
145,"While all species of freshwater pike are known to be violent, this particular variety has been recorded actually biting clean through the ankle bones of wading fishers. The sheer ferocity of the angry pike has inspired many a hedge knight to take the wavekin as his sigil.",5010,50,2,155,True
146,"The brilliant luster of this freshwater fish native to the Far East has made it a popular addition to the aquariums and garden ponds of Ul'dahn patricians. Once a rarity, recent overbreeding has seen a sharp drop in the market price for these wavekin.",5011,50,3,156,True
147,"When hunting, the Sagolii monkfish uses a method similar to its sea-bound cousin─attracting potential prey to its location with a glowing appendage situated directly above its gaping maw.",5043,50,4,146,True
148,"Lacking feet or wings to propel itself from the ground, only death awaits the saucerfish that is foolish enough to leave the Sea of Clouds. Ishgardian legend says that the saucerfish are the descendants(?) of a plate of fish tossed out a window and into the Sea of Clouds by a finicky king.",5044,50,5,155,True
149,"A large crimson crustacean commonly found hiding in the rocks off the shores of islands. The rich, flavorful tails are regarded as a delicacy across Eorzea.",4911,50,0,140,True
150,"Just as its name implies, the vampire lampern is indeed a sucker of blood, using its multiple rows of teeth to latch onto its prey, whether it be sea or land creature, and bore a hole from which to drink.",5012,50,2,137,True
151,"Legend states that this particular variety of sculpin is a favorite of Oschon, the Wanderer, and that the god will oft dine on this fish while on His journeys through the realm of man, for they are said to point Him in the direction of His next destination.",5013,50,2,155,True
152,"A large-mouthed saltwater glutton, thought to feed on most anything, from smaller fish, to seaweed, to the flesh of drowned sailors. Pullers despise these wavekin, for once they are caught in the pullers' nets, they will devour anything else caught with them.",4912,50,1,138,True
153,"It is said that not even a fishing line made from adamantium wire can withstand the cutting force of this legendary giant crustacean's claws.",5014,50,3,155,True
154,"Two front teeth of this freshwater fish are exceptionally long and therefore protrude from the mouth, giving them the appearance of coeurl fangs. Fishers bitten by these wavekin will attribute those bites to a real coeurl rather than admit to their colleagues that they were had by their catch.",5015,70,3,139,True
155,"Despite the modifier, the little Thalaos is anything but small, though; compared to the Thalaos of legend, even the largest of sea serpents would be deemed ""little."" As is the case with most deep-ocean fish, its body is composed of a thick wax-like fat and little else, making it an unpleasant addition to any dinner table.",4913,55,1,137,True
156,"This enormous bivalved mollusk is easily recognizable by the unique wave pattern found on its outer shell. An old fisher's tale tells of a man who accidentally stepped in the mouth of one during low tide. Unable to move due to the shell's crushing force, the man eventually drowned when the tide came in.",4914,55,0,135,True
157,"A giant freshwater fish native to the rivers and swamps of La Noscea. When not feeding in the early hours of the morning, the donko spends the majority of its time sleeping on the riverbed, conserving its energy for the hunt.",5016,55,2,180,True
158,"This freshwater fish has a bright yellow sun-like pattern across its body, giving to the name. Revered as holy by the Amalj'aa, it is forbidden amongst the beast tribe to even lay eyes upon one, let alone catch, gut, and roast one over an open flame.",5017,55,2,145,True
159,"Its name meaning ""stalwart"" in the Lalafellin tongue, this deep-sea predator is not only massive, but deceptively fast. Some sailors swear that a mahi-mahi can make the journey from Meracydia to the Cieldalaes in less than a fortnight, though knowing most sailors, that claim may be slightly exaggerated.",4915,55,1,135,True
160,"While similar to the sole or plaice in appearance and behavior, the halibut is much larger than both, and can feed a Lalafellin family of five for several turns of the sun.",4916,55,1,138,True
161,"A legendary freshwater fish said to have a head not unlike that of an alligator, complete with rows of razor-sharp teeth. The creature is oft used by Dunesfolk mothers who seek to frighten children who do not listen to their elders, go to bed early, or chew with their mouths closed.",5018,55,3,147,True
162,"After many generations of living and breeding in waters tainted with wootz ore, this knifefish has absorbed so much of the rare mineral into its body that it shows in its scales.",5019,55,3,147,True
163,"A giant freshwater fish found throughout Aldenard and known for its cat-like whiskers, which it uses to detect the movement of prey.",5020,55,3,139,True
164,"After maturing in the Grand Wake, caravan eels will form long lines in the sand and make their way back to the Sagolii desert to spawn and die.",5045,55,4,146,True
165,"A large saltwater fish found in the warm waters south of the Sea of Ash and known for its remarkable swimming speed. Legend says that after stealing one of Llymlaen's scepters and using that speed to escape, the Navigator was so infuriated that she placed a curse on the wavekin, dooming it to death if it ever slowed.",4917,50,1,137,True
166,"An ancient species of saltwater fish which appears to have flourished in times well before the Allagans built their empire. Thought normally to reside near the bottom of deep-sea trenches, the coelacanth has been known to rise to shallower waters in order to spawn─something it is believed the wavekin does only once during its hundred-summer lifespan.",4918,55,0,138,True
167,"Neither dead nor necrophagous, the cadaver carp is called such because of where it chooses to live─some of the most tainted, noisome, and foul waters in all of Eorzea. Despite this fact, however, the flesh of the cadaver carp is actually quite tasty.",5021,70,3,156,True
168,"Its massive lance-shaped nose makes this legendary denizen of the Sea of Clouds a formidable nuisance for airships passing through the area. Though not in any way, shape, or form a dragon, many Ishgardians believe the rhamphorhynchus to be a minion of the Dravanian Horde.",5046,70,5,155,True
169,"This rarely seen giant cephalopod makes an appearance in ancient Sea Wolf mythology as the creature on which the legendary whale Bismarck fed.",4919,55,1,138,True
170,"A legendary cephalopod feared by sailors young and old. Tales of these cyclopean creatures tearing up ships and dragging them down to the abyss can still be heard in alehouses and inns not only in Eorzea, but across Hydaelyn.",4920,70,1,138,True
171,"Legends say this giant saltwater fish will help those stranded in the water by allowing them to ride it back to shore.",4921,50,1,138,True
172,"A legendary shark-eating saltwater fish covered in thick armor and said to have once been worshipped by the Sahagin.",4922,70,1,137,True
173,"This amazing crab will rub its shell against funguars to collect spores, which it will then grow on its back. The fungi are said to induce visions, including those of a famous theologian who, after consuming one, claimed that he had a vision showing him the answer to the meaning of life─that answer being the number 41.",5022,55,3,152,True
174,"Named after the primal Ramuh's signature weapon, this strange freshwater fish will only feed when the weather is rainy.",5023,55,3,153,True
175,"The rock-hard and rock-heavy scales of this variety of freshwater garpike are spattered with scores of unhealthy-looking spots.",5024,55,3,156,True
176,"This giant freshwater fish lives out its adulthood feeding in the Indigo Deep before returning all the way back up to the head of the White Maiden to spawn. Its eggs are considered a delicacy among Ishgardian nobility and the Ul'dahn elite, and this has led to severe overfishing of the species. Now it is believed that only a few hundred remain.",5025,55,2,155,True
177,"Records of the bowfin being caught in the Black Shroud date back to the time of the first Elezen settlers, and according to the Seedseers of Stillglade Fane, the elementals tell us that the elongated wavekin was one of the first of the Twelve's creations. ",5026,55,2,154,True
178,"A flat freshwater bottom-feeder found predominantly in marshes and swamps, where it can hide under the blanket of organic detritus collected on the floor. Some naturalists claim this particular species of wavekin can see up to a thousand summers...though, as the average life expectancy of a naturalist is but four score summers, these claims hold little weight.",5027,70,2,156,True
179,"A legendary shark with a mouth so large and an appetite so enormous, it is said it can swallow an adult Roegadyn whole. This can be attested to by a former Roegadyn king who actually was swallowed whole by a megalodon before carving his way out of its belly with a dagger.",4923,70,1,138,True
180,"Feared by sailors and fishers alike, legends say that this gargantuan saltwater fish once ripped a hundred-man galleon in two with its saw-like head.",4924,70,1,140,True
181,"A legendary giant freshwater fish indigenous to the lands of the Far East. The takitaro found in Eorzea are thought to be the offspring of a specimen presented as a gift to an eccentric sultan who loosed the fish into a cenote when it grew too large to keep in the royal aquariums.",5028,70,3,153,True
182,"A legendary giant freshwater fish rumored to live in the bottomless swamps hidden deep within the unexplored regions of the Black Shroud. This snake-like wavekin is rumored to grow as long as an Elezen is tall.",5029,70,3,154,True
183,"A giant freshwater fish so shrouded in mystery, that naught is known of it...except that it may take as many as five score years for the Morinabaligi to mature...and that its eggs are delicious...and that those eggs are poisonous...and that this fact still does not prevent many adventuring elite from supping on the rare delicacy.",5030,70,2,156,True
184,"It is said that jungle catfish can grow to become as large as an aurochs, and while there are sightings aplenty of these massive specimens, one that large has yet to be caught.",5031,55,2,137,True
185,"Not native to Eorzea, the first adamantoise to arrive in the realm is believed to have been mixed in with a shipment of dodo eggs from the Near East. Why anyone would import dodo eggs when there are more than enough of the birds living in Eorzea already is a mystery for the ages...but the whole affair more than likely involves a hungry Qiqirn.",6185,50,0,135,True
186,"Though able to levitate while in tadpole form, the gigantoad loses this biologically unexplainable characteristic the moment it sprouts legs and gravity remembers its duty. It is, however, all for the better, because really, who wants to encounter a flying gigantoad while traipsing through the wilderness?",6191,50,3,145,True
187,"",0,0,0,0,True
188,"",0,0,0,0,True
189,"",0,0,0,0,True
190,"",0,0,0,0,True
191,"",0,0,0,0,True
192,"",0,0,0,0,True
193,"",0,0,0,0,True
194,"",0,0,0,0,True
195,"",0,0,0,0,True
196,"",0,0,0,0,True
197,"",0,0,0,0,True
198,"",0,0,0,0,True
199,"",0,0,0,0,True
200,"",0,0,0,0,True
201,"",0,0,0,0,True
202,"",0,0,0,0,True
203,"",0,0,0,0,True
204,"",0,0,0,0,True
205,"",0,0,0,0,True
206,"",0,0,0,0,True
207,"",0,0,0,0,True
208,"",0,0,0,0,True
209,"",0,0,0,0,True
210,"",0,0,0,0,True
211,"",0,0,0,0,True
212,"",0,0,0,0,True
213,"",0,0,0,0,True
214,"",0,0,0,0,True
215,"",0,0,0,0,True
216,"",0,0,0,0,True
217,"",0,0,0,0,True
218,"",0,0,0,0,True
219,"",0,0,0,0,True
220,"",0,0,0,0,True
221,"",0,0,0,0,True
222,"",0,0,0,0,True
223,"",0,0,0,0,True
224,"",0,0,0,0,True
225,"",0,0,0,0,True
226,"",0,0,0,0,True
227,"",0,0,0,0,True
228,"",0,0,0,0,True
229,"",0,0,0,0,True
230,"",0,0,0,0,True
231,"",0,0,0,0,True
232,"",0,0,0,0,True
233,"",0,0,0,0,True
234,"",0,0,0,0,True
235,"",0,0,0,0,True
236,"",0,0,0,0,True
237,"",0,0,0,0,True
238,"",0,0,0,0,True
239,"",0,0,0,0,True
240,"",0,0,0,0,True
241,"",0,0,0,0,True
242,"",0,0,0,0,True
243,"",0,0,0,0,True
244,"",0,0,0,0,True
245,"",0,0,0,0,True
246,"",0,0,0,0,True
247,"",0,0,0,0,True
248,"",0,0,0,0,True
249,"",0,0,0,0,True
250,"",0,0,0,0,True
251,"",0,0,0,0,True
252,"",0,0,0,0,True
253,"",0,0,0,0,True
254,"",0,0,0,0,True
255,"",0,0,0,0,True
256,"",0,0,0,0,True
257,"",0,0,0,0,True
258,"",0,0,0,0,True
259,"",0,0,0,0,True
260,"",0,0,0,0,True
261,"",0,0,0,0,True
262,"",0,0,0,0,True
263,"",0,0,0,0,True
264,"",0,0,0,0,True
265,"",0,0,0,0,True
266,"",0,0,0,0,True
267,"",0,0,0,0,True
268,"",0,0,0,0,True
269,"",0,0,0,0,True
270,"",0,0,0,0,True
271,"",0,0,0,0,True
272,"",0,0,0,0,True
273,"",0,0,0,0,True
274,"",0,0,0,0,True
275,"",0,0,0,0,True
276,"",0,0,0,0,True
277,"",0,0,0,0,True
278,"",0,0,0,0,True
279,"",0,0,0,0,True
280,"",0,0,0,0,True
281,"",0,0,0,0,True
282,"",0,0,0,0,True
283,"",0,0,0,0,True
284,"",0,0,0,0,True
285,"",0,0,0,0,True
286,"",0,0,0,0,True
287,"",0,0,0,0,True
288,"",0,0,0,0,True
289,"",0,0,0,0,True
290,"",0,0,0,0,True
291,"",0,0,0,0,True
292,"",0,0,0,0,True
293,"",0,0,0,0,True
294,"",0,0,0,0,True
295,"",0,0,0,0,True
296,"",0,0,0,0,True
297,"",0,0,0,0,True
298,"",0,0,0,0,True
299,"",0,0,0,0,True
300,"",0,0,0,0,True
301,"",0,0,0,0,True
302,"",0,0,0,0,True
303,"",0,0,0,0,True
304,"",0,0,0,0,True
305,"",0,0,0,0,True
306,"",0,0,0,0,True
307,"",0,0,0,0,True
308,"",0,0,0,0,True
309,"",0,0,0,0,True
310,"",0,0,0,0,True
311,"",0,0,0,0,True
312,"",0,0,0,0,True
313,"",0,0,0,0,True
314,"",0,0,0,0,True
315,"",0,0,0,0,True
316,"",0,0,0,0,True
317,"",0,0,0,0,True
318,"",0,0,0,0,True
319,"",0,0,0,0,True
320,"",0,0,0,0,True
321,"",0,0,0,0,True
322,"",0,0,0,0,True
323,"",0,0,0,0,True
324,"",0,0,0,0,True
325,"",0,0,0,0,True
326,"",0,0,0,0,True
327,"",0,0,0,0,True
328,"",0,0,0,0,True
329,"",0,0,0,0,True
330,"",0,0,0,0,True
331,"",0,0,0,0,True
332,"",0,0,0,0,True
333,"",0,0,0,0,True
334,"",0,0,0,0,True
335,"",0,0,0,0,True
336,"",0,0,0,0,True
337,"",0,0,0,0,True
338,"",0,0,0,0,True
339,"",0,0,0,0,True
340,"",0,0,0,0,True
341,"",0,0,0,0,True
342,"",0,0,0,0,True
343,"",0,0,0,0,True
344,"",0,0,0,0,True
345,"",0,0,0,0,True
346,"",0,0,0,0,True
347,"",0,0,0,0,True
348,"",0,0,0,0,True
349,"",0,0,0,0,True
350,"",0,0,0,0,True
351,"",0,0,0,0,True
352,"",0,0,0,0,True
353,"",0,0,0,0,True
354,"",0,0,0,0,True
355,"",0,0,0,0,True
356,"",0,0,0,0,True
357,"",0,0,0,0,True
358,"",0,0,0,0,True
359,"",0,0,0,0,True
360,"",0,0,0,0,True
361,"",0,0,0,0,True
362,"",0,0,0,0,True
363,"",0,0,0,0,True
364,"",0,0,0,0,True
365,"",0,0,0,0,True
366,"",0,0,0,0,True
367,"",0,0,0,0,True
368,"",0,0,0,0,True
369,"",0,0,0,0,True
370,"",0,0,0,0,True
371,"",0,0,0,0,True
372,"",0,0,0,0,True
373,"",0,0,0,0,True
374,"",0,0,0,0,True
375,"",0,0,0,0,True
376,"",0,0,0,0,True
377,"",0,0,0,0,True
378,"",0,0,0,0,True
379,"",0,0,0,0,True
380,"",0,0,0,0,True
381,"",0,0,0,0,True
382,"",0,0,0,0,True
383,"",0,0,0,0,True
384,"",0,0,0,0,True
385,"",0,0,0,0,True
386,"",0,0,0,0,True
