key,0,1
213,"TEXT_MANFST200_00507_FLAMEA_000_151","Flame General Raubahn will receive you in the Fragrant Chamber. Please take the lift down to the Hustings Strip and speak with Bartholomew at the Royal Promenade."
214,"TEXT_MANFST200_00507_FLAMEA_000_153","The lift over yonder will take you to the Hustings Strip. From there proceed south to the Royal Promenade, and speak with Bartholomew to gain admittance to the Fragrant Chamber."
215,"TEXT_MANFST200_00507_BARTHOLOMEW_000_160","The Gridanian envoy, I presume? Pray allow me to inspect your missive, <If(PlayerParameter(4))>madam<Else/>sir</If>."
216,"TEXT_MANFST200_00507_BARTHOLOMEW_000_161","This does indeed bear the Elder Seedseer's seal. You may proceed."
217,"TEXT_MANFST200_00507_300420_RAUBAHN","Ah, a guest from Gridania. I thought I smelled leaf mold."
218,"TEXT_MANFST200_00507_300430_RAUBAHN","I won't hold it against you. If you're half the warrior Kan-E says, 'tis a wonder you don't reek of dead Ixal."
219,"TEXT_MANFST200_00507_300440_RAUBAHN","Welcome to the Sultanate of Ul'dah. I am Raubahn Aldynn, General of the Immortal Flames."
220,"TEXT_MANFST200_00507_300450_RAUBAHN","But you did not come all this way to trade formalities."
221,"TEXT_MANFST200_00507_300460_RAUBAHN","There's something familiar about you... For a moment, I mistook you for an old <If(PlayerParameter(4))>sister-in-arms<Else/>brother-in-arms</If>."
222,"TEXT_MANFST200_00507_300470_RAUBAHN","Like <If(PlayerParameter(4))>her<Else/>him</If>, you have the eyes of a hero. Eyes that have looked upon the horrors of battle, unblinking."
223,"TEXT_MANFST200_00507_300480_RAUBAHN","I've no doubt Kan-E saw them, too. Mayhap there is hope for Gridania yet! Come, let us talk."
224,"TEXT_MANFST200_00507_RAUBAHN_000_171","Carteneau. Aye, I remember bloody Carteneau."
225,"TEXT_MANFST200_00507_RAUBAHN_000_172","Do you know what happened that day, adventurer? When we took the field against the Garleans?"
226,"TEXT_MANFST200_00507_RAUBAHN_000_173","So my counterparts have educated you."
227,"TEXT_MANFST200_00507_RAUBAHN_000_174","Hm? So Merlwyb means to make light of our wolf problem, does she? The woman always did have a black sense of humor."
228,"TEXT_MANFST200_00507_RAUBAHN_000_175","Wolves are ravenous beasts and cannot be ignored. It's only a matter of time before they pose a threat."
229,"TEXT_MANFST200_00507_RAUBAHN_000_176","So it was with the Garleans, fifty years ago."
230,"TEXT_MANFST200_00507_RAUBAHN_000_177","No sooner had they learned how to use magitek than they began seizing territory from their neighbors."
231,"TEXT_MANFST200_00507_RAUBAHN_000_178","Led by then legatus Solus zos Galvus, they soon brought the other nations of Ilsabard to heel. And so the legatus became an emperor, and his republic an empire─"
232,"TEXT_MANFST200_00507_RAUBAHN_000_179","An empire which then set its sights upon Eorzea."
233,"TEXT_MANFST200_00507_ROAILLE_000_180","But the conquering emperor is now an old man of four score winters. His health is failing, and he has no clear successor. Like as not, this is why the Garleans have been keeping quiet."
234,"TEXT_MANFST200_00507_RAUBAHN_000_181","But the XIVth Imperial Legion is still entrenched within our borders."
235,"TEXT_MANFST200_00507_RAUBAHN_000_182","And their commander, Legatus Gaius van Baelsar, has long harbored ambitions of conquest."
236,"TEXT_MANFST200_00507_RAUBAHN_000_183","Were he to strike now, I fear we would fall like so many others. Not only Ul'dah, but Gridania and Limsa Lominsa as well."
237,"TEXT_MANFST200_00507_RAUBAHN_000_184","For the Calamity has left us weakened, and the beast tribes will stop at nothing to summon their dread primals."
238,"TEXT_MANFST200_00507_RAUBAHN_000_185","We are a realm divided, adventurer. An alliance in name only."
239,"TEXT_MANFST200_00507_RAUBAHN_000_186","But the wolf cares not for the plight of its prey."
240,"TEXT_MANFST200_00507_RAUBAHN_000_187","The Garleans stir, and the Admiral means to warn us."
241,"TEXT_MANFST200_00507_RAUBAHN_000_188","All other concerns pale in comparison to the Empire─even the beast tribes and their bloody primals."
242,"TEXT_MANFST200_00507_RAUBAHN_000_189","Aye, we must stand united once more. And to do this, we must <Emphasis>remember</Emphasis>."
243,"TEXT_MANFST200_00507_RAUBAHN_000_190","We will honor the memory of the fallen.  We will remind the people what their brothers and sisters fought and died for."
244,"TEXT_MANFST200_00507_ROAILLE_000_191","Shall I inform the sultana and the other Syndicate members?"
245,"TEXT_MANFST200_00507_RAUBAHN_000_192","I will speak with Her Grace myself."
246,"TEXT_MANFST200_00507_ROAILLE_000_193","Understood, sir."
247,"TEXT_MANFST200_00507_RAUBAHN_000_194","The Elder Seedseer will have my prompt reply."
248,"TEXT_MANFST200_00507_RAUBAHN_000_195","My thanks to you, adventurer."
249,"TEXT_MANFST200_00507_SYSTEM_000_300","You now have access to airships connecting the three nations. Flights may be boarded by paying the requisite fee in gil."
