376,"Searing Wind","Ignited by white-hot embers and scorching those nearby. Sustaining fire damage over time.",15560,0,2,61,False,False,False,False,False,False,200,False,0,False,False
377,"Infernal Fetters","A prison of fire is reducing damage dealt and inflicting fire damage over time.",17201,8,2,61,False,False,False,False,False,False,50,False,0,False,False
378,"Death Throes","Held firmly by the leg and unable to move.",15003,0,2,61,True,True,False,False,True,True,100,False,0,False,False
379,"Thermal Low","The wind is high. Sustaining wind damage over time.",17241,3,2,61,False,False,False,False,False,False,100,False,0,False,False
380,"Thermal High","The wind has died. Resistance to wind damage is increased.",15569,0,1,60,False,False,False,False,True,True,0,False,0,False,False
381,"Testudo","Damage taken is reduced.",14801,0,1,60,False,False,False,False,False,False,0,False,0,False,False
382,"テストゥド：不可","新たに「テストゥド」がかからない状態。",0,0,2,61,False,False,False,False,False,False,50,False,0,False,False
383,"","",0,0,0,0,False,False,False,False,False,False,0,False,0,False,False
384,"Thrill of War","Maximum HP is increased.",14803,0,1,60,False,False,False,False,False,False,5,False,0,False,False
385,"Full Swing","Taking damage over time.",14804,0,2,61,False,False,False,False,False,False,10,False,0,False,False
386,"Somersault","Spell speed is reduced.",14805,0,2,61,False,False,False,False,False,False,50,False,0,False,False
387,"Fetter Ward","Immune to the effects of stun, sleep, bind, heavy, and disease.",14806,0,1,60,False,False,False,False,False,False,0,False,0,False,False
388,"Impulse Rush","Weaponskills cost less TP to execute.",14807,0,1,60,False,False,False,False,False,False,0,False,0,False,False
389,"Skewer","Intelligence is reduced.",14808,0,2,61,False,False,False,False,False,False,50,False,0,False,False
390,"Sacred Prism","A veil of succor is healing party members in the area.",14809,0,1,60,False,False,False,False,False,False,0,False,0,False,False
391,"Phantom Dart","All elemental resistances are reduced.",14810,0,2,61,False,False,False,False,False,False,50,False,0,False,False
392,"Misty Veil","Attack range is reduced.",14811,0,2,61,False,False,False,False,False,False,100,False,0,False,False
393,"Wither","All elemental resistances are reduced.",14812,0,2,61,False,False,False,False,False,False,50,False,0,False,False
394,"Focalization","All elemental resistances are increased.",14813,0,1,60,False,False,False,False,False,False,0,False,0,False,False
395,"Aetheric Burst","Skill speed is reduced.",14814,0,2,61,False,False,False,False,False,False,50,False,0,False,False
396,"Equanimity","Casting is not interrupted by damage.",14815,0,1,60,False,False,False,False,False,False,0,False,0,False,False
397,"Attunement","Evasion is greatly enhanced, and damage taken is reduced.",14816,0,1,60,True,True,False,False,False,False,0,False,0,False,False
398,"Astral Realignment","Existentially aligned to the astral realm. Damage dealt is reduced, but can attack ghostly beings.",15562,0,2,61,False,False,False,False,False,False,0,False,0,False,True
399,"Corporeal Return","Weakened by the time in astral realignment. Damage taken is doubled.",15563,0,2,61,False,False,False,False,False,False,0,False,0,False,False
400,"Charge","Storing lightning energy. Resistance to lightning damage is reduced.",17261,8,2,60,False,False,False,False,False,False,0,False,0,False,False
401,"Death Grip","Held in the iron claws' vice-like grip and cannot act. Taking damage over time.",15564,0,2,61,True,True,False,False,True,True,0,False,0,False,False
402,"Thrown for a Loop","Provoked beyond all mortal limits. Can only pursue and auto-attack the target.",15565,0,2,61,False,False,True,True,False,False,100,False,0,False,False
403,"Determination Up","Damage dealt is increased.",15519,0,1,60,False,False,False,False,False,True,200,False,0,False,False
404,"Transporting","Carrying an object in your arms, growing wearier with each passing second.",16208,0,1,60,False,False,False,False,False,False,200,False,0,False,False
405,"Bewildered","Confused and unable to control your actions.",15545,0,2,61,False,False,False,False,True,True,100,False,0,False,False
406,"Vulnerability Down","Damage taken is reduced.",17301,8,1,60,False,False,False,False,True,True,30,False,0,False,False
407,"Dust Poisoning","Poisoned by the crystal dust you inhaled. A stack of 4 will render you unable to act.",17001,4,2,41,False,False,False,False,False,False,200,False,0,False,False
408,"Storm's Path","Damage dealt is reduced.",10415,0,2,61,False,False,False,False,False,False,50,False,0,False,False
409,"Holmgang","Unable to move until effect fades. Most attacks cannot reduce your HP to less than 1.",10405,0,2,61,False,False,False,False,False,False,100,False,0,False,False
410,"Antibody","Immune to the effects of virus and fever.",10915,0,1,61,False,False,False,False,False,False,30,False,0,False,False
411,"Inner Beast","Damage taken is reduced.",13203,0,1,60,False,False,False,False,False,False,30,False,0,False,False
412,"Hover","Floating above ground.",15024,0,1,60,False,False,False,False,True,False,200,False,0,False,False
413,"Mark Up","Wolf Marks earned is increased.",16517,0,1,60,False,False,False,False,True,True,0,True,0,True,False
414,"Seal Sweetener","Company seals earned is increased.",16518,0,1,60,False,False,False,False,True,True,0,True,0,True,False
415,"Regain","Gradually regenerating TP.",16203,0,1,60,False,False,False,False,False,False,5,False,0,False,False
416,"Transparent","Body is allowing light to pass, rendering you invisible to the enemy.",16209,0,1,60,False,False,False,False,False,False,2,False,0,False,True
417,"","",0,0,0,0,False,False,False,False,False,False,0,False,0,False,False
418,"Physical Vulnerability Down","Physical damage taken is reduced.",15052,0,1,60,False,False,False,False,False,True,30,False,0,False,False
419,"Misty Veil","Attack range is reduced.",14811,0,2,61,False,False,False,False,False,False,100,False,0,False,False
420,"","",0,0,0,0,False,False,False,False,False,False,0,False,0,False,False
