key,0,1,2,3,4,5,6,7,8,9,10,11,12,13,14,15,16
#,Name,Description,Icon,,MaxStacks,ClassJobCategory,StatusCategory,HitEffect,VFX,LockMovement,,LockActions,LockControl,Transfiguration,IsGaze,CanDispel,InflictedByActor
int32,str,str,Image,byte,byte,ClassJobCategory,bool,StatusHitEffect,StatusLoopVFX,bool,bool,bool,byte,bool,uint16,bool,bool
0,"","",0,0,0,0,False,False,False,False,False,False,0,False,0,False,False
1,"Petrification","Stone-like rigidity is preventing the execution of actions.",15001,0,2,47,True,True,False,False,False,False,100,False,0,False,False
2,"Stun","Unable to execute actions.",15004,0,2,43,True,True,False,False,False,False,100,False,0,False,False
3,"Sleep","Overwhelming drowsiness is preventing the execution of actions.",15013,0,2,42,True,True,False,False,False,False,100,False,0,False,False
4,"Daze","Scattered senses are preventing the execution of actions.",15003,0,2,50,True,True,False,False,False,False,100,False,0,False,False
5,"Amnesia","Unable to use abilities.",15015,0,2,59,False,False,False,False,False,False,100,False,0,False,False
6,"Pacification","Unable to use weaponskills.",15017,0,2,58,False,False,False,False,False,False,100,False,0,False,False
7,"Silence","A stifling magic is preventing casts.",15005,0,2,48,False,False,False,False,False,False,100,False,0,False,False
8,"Haste","Weaponskill recast time, spell recast time, and auto-attack delay are reduced.",15008,0,1,60,False,False,False,False,False,False,1,False,0,False,False
9,"Slow","Weaponskill recast time, spell recast time, and auto-attack delay are increased.",15009,0,2,56,False,False,False,False,False,False,50,False,0,False,False
10,"Slow","Weaponskill recast time, spell recast time, and auto-attack delay are increased.",15545,0,2,56,False,False,False,False,True,True,50,False,0,False,False
11,"Charmed","Your mind is being controlled by the enemy.",15559,0,2,61,False,False,True,True,False,False,100,False,0,False,False
12,"","",0,0,0,0,False,False,False,False,False,False,0,False,0,False,False
13,"Bind","Unable to move.",15003,0,2,54,True,False,False,False,False,False,100,False,0,False,False
14,"Heavy","Movement speed is reduced.",15002,0,2,44,False,False,False,False,False,False,100,False,0,False,False
15,"Blind","Encroaching darkness is lowering accuracy.",15012,0,2,52,False,False,False,False,False,False,50,False,0,False,False
16,"","",0,0,0,0,False,False,False,False,False,False,0,False,0,False,False
17,"Paralysis","Deadened nerves are sometimes preventing the execution of actions.",15006,0,2,46,False,False,False,False,False,False,100,False,0,False,False
18,"Poison","Toxins are causing damage over time.",15007,0,2,41,False,False,False,False,False,False,10,False,0,False,False
19,"Pollen","Deadly pollen has filled the lungs, causing damage over time.",15517,0,2,41,False,False,False,False,True,True,10,False,0,False,False
20,"TP Bleed","Bleeding TP over time.",15025,0,2,61,False,False,False,False,False,False,10,False,0,False,False
21,"HP Boost","Maximum HP is increased.",15075,0,1,60,False,False,False,False,False,False,1,False,0,False,False
22,"HP Penalty","Maximum HP is reduced.",15076,0,2,61,False,False,False,False,False,False,50,False,0,False,False
23,"MP Boost","Maximum MP is increased.",15077,0,1,60,False,False,False,False,False,False,1,False,0,False,False
24,"MP Penalty","Maximum MP is reduced.",15078,0,2,61,False,False,False,False,False,False,50,False,0,False,False
25,"Attack Up","Attack power is enhanced.",15050,0,1,60,False,False,False,False,False,False,1,False,0,False,False
26,"Attack Down","Attack power is reduced.",15051,0,2,61,False,False,False,False,False,False,50,False,0,False,False
27,"Accuracy Up","Accuracy is enhanced.",15060,0,1,60,False,False,False,False,False,False,1,False,0,False,False
28,"Accuracy Down","Accuracy is reduced.",15061,0,2,61,False,False,False,False,False,False,50,False,0,False,False
29,"Defense Up","Defense is enhanced.",15052,0,1,60,False,False,False,False,False,False,1,False,0,False,False
30,"Defense Down","Defense is reduced.",15053,0,2,61,False,False,False,False,False,False,50,False,0,False,False
31,"Evasion Up","Evasion is enhanced.",15062,0,1,60,False,False,False,False,False,False,1,False,0,False,False
32,"Evasion Down","Evasion is reduced.",15063,0,2,61,False,False,False,False,False,False,50,False,0,False,False
33,"Attack Magic Potency Up","Attack magic potency is enhanced.",15054,0,1,60,False,False,False,False,False,False,1,False,0,False,False
34,"Attack Magic Potency Down","Attack magic potency is reduced.",15055,0,2,61,False,False,False,False,False,False,50,False,0,False,False
35,"Healing Potency Up","Healing magic potency is enhanced.",15058,0,1,60,False,False,False,False,False,False,1,False,0,False,False
36,"Healing Potency Down","Healing magic potency is reduced.",15059,0,2,61,False,False,False,False,False,False,50,False,0,False,False
37,"Magic Defense Up","Magic defense is enhanced.",15056,0,1,60,False,False,False,False,False,False,1,False,0,False,False
38,"Magic Defense Down","Magic defense is reduced.",15057,0,2,61,False,False,False,False,False,False,50,False,0,False,False
39,"Stun Resistance","Immune to stun effects.",15566,0,1,60,False,False,False,False,True,True,100,False,0,False,False
40,"Silence Resistance","Immune to silence effects.",15567,0,1,60,False,False,False,False,True,True,100,False,0,False,False
41,"","",0,0,0,0,False,False,False,False,False,False,0,False,0,False,False
42,"","",0,0,0,0,False,False,False,False,False,False,0,False,0,False,False
43,"Weakness","All attributes are reduced by 15%.",15010,0,2,0,False,False,False,False,False,False,100,False,0,False,False
44,"Brink of Death","All attributes are reduced by 30%.",15011,0,2,0,False,False,False,False,False,False,100,False,0,False,False
45,"Crafter's Grace","Chance of increased experience point gains as a Disciple of the Hand.",16106,0,1,60,False,False,False,False,False,False,0,False,0,False,False
46,"Gatherer's Grace","Chance of increased experience point gains as a Disciple of the Land.",16006,0,1,60,False,False,False,False,False,False,0,False,0,False,False
47,"Stealth","Cannot be detected by enemies. Movement speed is reduced.",16001,0,1,60,False,False,False,False,True,True,2,False,0,False,True
48,"Well Fed","Enjoying the benefits of a full belly.",16202,0,1,60,False,False,False,False,False,False,0,False,0,False,False
49,"Medicated","Performance is being enhanced by a medicinal item.",16203,0,1,60,False,False,False,False,False,False,0,False,0,False,False
50,"Sprint","Movement speed is increased.",10101,0,1,0,False,False,False,False,False,False,0,False,0,False,False
51,"Strength Down","Strength is reduced.",15080,0,2,61,False,False,False,False,False,False,50,False,0,False,False
52,"Vitality Down","Vitality is reduced.",15082,0,2,61,False,False,False,False,False,False,50,False,0,False,False
53,"Physical Damage Up","Physical damage dealt is increased.",15050,0,1,60,False,False,False,False,False,False,1,False,0,False,False
54,"Physical Damage Down","Physical damage dealt is reduced.",15051,0,2,61,False,False,False,False,False,False,50,False,0,False,False
55,"Physical Vulnerability Down","Physical damage taken is reduced.",15052,0,1,60,False,False,False,False,False,False,1,False,0,False,False
56,"Physical Vulnerability Up","Physical damage taken is increased.",15053,0,2,61,False,False,False,False,False,False,50,False,0,False,False
57,"Magic Damage Up","Magic damage dealt is increased.",15054,0,1,60,False,False,False,False,False,False,1,False,0,False,False
58,"Magic Damage Down","Magic damage dealt is reduced.",15055,0,2,61,False,False,False,False,False,False,50,False,0,False,False
59,"Magic Vulnerability Down","Magic damage taken is reduced.",15056,0,1,60,False,False,False,False,False,False,1,False,0,False,False
60,"Magic Vulnerability Up","Magic damage taken is increased.",15057,0,2,61,False,False,False,False,False,False,50,False,0,False,False
61,"Determination Up","Damage dealt is increased.",15519,0,1,60,False,False,False,False,False,False,1,False,0,False,False
62,"Determination Down","Damage dealt is reduced.",15520,0,2,61,False,False,False,False,False,False,50,False,0,False,False
63,"Vulnerability Down","Damage taken is reduced.",15021,0,1,60,False,False,False,False,False,False,1,False,0,False,False
64,"Vulnerability Up","Damage taken is increased.",15020,0,2,61,False,False,False,False,False,False,50,False,0,False,False
65,"Critical Skill","All weaponskills are dealing critical damage.",15016,0,1,60,False,False,False,False,False,False,1,False,0,False,False
66,"Terror","Frozen with fear.",15516,0,2,178,True,True,False,False,False,False,100,False,0,False,False
67,"Leaden","Movement speed is reduced, and cannot be restored by normal means.",15518,0,2,44,False,False,False,False,True,True,100,False,0,False,False
68,"Drainstrikes","Auto-attacks are generating an Absorb HP effect.",15504,0,1,60,False,False,False,False,False,False,1,False,0,False,False
69,"Aspirstrikes","Auto-attacks are generating an Absorb MP effect.",15505,0,1,60,False,False,False,False,False,False,1,False,0,False,False
70,"Stunstrikes","Auto-attacks may stun target.",15506,0,1,60,False,False,False,False,False,False,1,False,0,False,False
71,"Rampart","Damage taken is reduced.",10202,0,1,60,False,False,False,False,False,False,0,False,0,False,False
72,"Convalescence","HP recovery via curing magic is increased.",10207,0,1,60,False,False,False,False,False,False,1,False,0,False,False
73,"Awareness","Cannot suffer critical damage.",10204,0,1,60,False,False,False,False,False,False,0,False,0,False,False
74,"Sentinel","Damage taken is reduced.",10201,0,1,60,False,False,False,False,False,False,0,False,0,False,False
75,"Tempered Will","Immune to knockback and draw-in effects.",10203,0,1,60,False,False,False,False,False,False,0,False,0,False,False
76,"Fight or Flight","Physical damage dealt is increased.",10205,0,1,60,False,False,False,False,False,False,0,False,0,False,False
77,"Bulwark","Block rate is increased.",10206,0,1,60,False,False,False,False,False,False,0,False,0,False,False
78,"Sword Oath","Auto-attacks are enhanced.",13005,0,1,60,False,False,False,False,True,True,0,True,0,False,False
79,"Shield Oath","Damage taken and dealt is reduced, while enmity is increased.",13006,0,1,60,False,False,False,False,True,True,0,True,0,False,False
80,"Cover","Protecting a party member.",13001,0,1,60,False,False,False,False,False,False,100,True,0,False,False
81,"Covered","Under the protection of a party member.",13002,0,1,60,False,False,False,False,False,False,100,True,0,False,False
82,"Hallowed Ground","Impervious to most attacks.",13004,0,1,60,False,False,False,False,False,False,70,False,0,False,False
83,"Foresight","Defense is increased.",10402,0,1,60,False,False,False,False,False,False,0,False,0,False,False
84,"Bloodbath","Physical attacks generate HP equal to a portion of damage dealt.",10401,0,1,60,False,False,False,False,False,False,0,False,0,False,False
85,"Maim","Damage dealt is increased.",10412,0,1,60,False,False,False,False,False,False,0,False,0,False,False
86,"Berserk","Attack power is enhanced. Will be unable to use weaponskills for several seconds after effect ends.",10403,0,1,60,False,False,False,False,False,False,0,False,0,False,False
87,"Thrill of Battle","Maximum HP is increased.",10404,0,1,60,False,False,False,False,False,False,5,False,0,False,False
88,"Holmgang","Unable to move until effect fades.",10405,0,2,61,True,False,False,False,False,False,100,False,0,False,False
89,"Vengeance","Inflicting a portion of sustained damage back to its source.",10406,0,1,60,False,False,False,False,False,False,1,False,0,False,False
90,"Storm's Eye","Slashing resistance and HP recovery via curing magic are reduced.",10413,0,2,61,False,False,False,False,False,False,50,False,0,False,False
91,"Defiance","Maximum HP, HP recovery, and enmity are increased, while damage dealt is reduced. Using certain actions will incur Wrath.",13201,0,1,60,False,False,False,False,True,True,0,True,0,False,False
92,"Unchained","Damage penalty inflicted by Defiance is nullified.",13202,0,1,60,False,False,False,False,False,False,0,False,0,False,False
93,"Wrath","Critical hit rate is increased.",10407,0,1,60,False,False,False,False,False,False,0,False,0,False,False
94,"Wrath II","Critical hit rate is increased.",10408,0,1,60,False,False,False,False,False,False,0,False,0,False,False
95,"Wrath III","Critical hit rate is increased.",10409,0,1,60,False,False,False,False,False,False,0,False,0,False,False
96,"Wrath IV","Critical hit rate is increased.",10410,0,1,60,False,False,False,False,False,False,0,False,0,False,False
97,"Infuriated","Critical hit rate is increased.",10411,0,1,60,False,False,False,False,False,False,0,False,0,False,False
98,"Dragon Kick","Blunt resistance and intelligence are reduced.",10315,0,2,61,False,False,False,False,False,False,50,False,0,False,False
99,"Featherfoot","Evasion is enhanced.",10301,0,1,60,False,False,False,False,False,False,0,False,0,False,False
100,"Internal Release","Critical hit rate is increased.",10304,0,1,60,False,False,False,False,False,False,0,False,0,False,False
101,"Twin Snakes","Damage dealt is increased.",10316,0,1,60,False,False,False,False,False,False,0,False,0,False,False
102,"Mantra","HP recovery via curing magic is increased.",10306,0,1,60,False,False,False,False,False,False,5,False,0,False,False
103,"Fists of Fire","Damage dealt is increased.",10302,0,1,60,False,False,False,False,True,True,0,True,528,False,False
104,"Fists of Earth","Damage taken is reduced.",10303,0,1,60,False,False,False,False,True,True,0,True,528,False,False
105,"Fists of Wind","Movement speed is increased.",13101,0,1,60,False,False,False,False,True,True,0,True,528,False,False
106,"Touch of Death","Organs are failing, causing damage over time.",10311,0,2,61,False,False,False,False,False,False,10,False,0,False,False
107,"Opo-opo Form","Employing the opo-opo fighting stance.",10312,0,1,60,False,False,False,False,False,False,0,True,528,False,False
108,"Raptor Form","Employing the raptor fighting stance.",10313,0,1,60,False,False,False,False,False,False,0,True,528,False,False
109,"Coeurl Form","Employing the coeurl fighting stance.",10314,0,1,60,False,False,False,False,False,False,0,True,528,False,False
110,"Perfect Balance","Employing all three pugilistic fighting stances─opo-opo, raptor, and coeurl.",10317,0,1,60,False,False,False,False,False,False,0,True,528,False,False
111,"Greased Lightning","Damage dealt and attack speed are increased.",10307,0,1,60,False,False,False,False,False,False,0,True,0,False,False
112,"Greased Lightning II","Damage dealt and attack speed are increased.",10308,0,1,60,False,False,False,False,False,False,0,True,0,False,False
113,"Greased Lightning III","Damage dealt and attack speed are increased.",10309,0,1,60,False,False,False,False,False,False,0,True,0,False,False
114,"Keen Flurry","Chance to parry is increased.",10501,0,1,60,False,False,False,False,False,False,0,False,0,False,False
115,"Heavy Thrust","Damage dealt is increased.",10506,0,1,60,False,False,False,False,False,False,0,False,0,False,False
116,"Life Surge","Next non-magic action is a critical hit with resulting damage being absorbed as HP.",10502,0,1,60,False,False,False,False,False,False,0,False,0,False,False
117,"Blood for Blood","Increasing damage dealt while increasing damage taken.",10504,0,1,60,False,False,False,False,False,False,0,False,0,False,False
118,"Chaos Thrust","Wounds are bleeding, causing damage over time.",10507,0,2,61,False,False,False,False,False,False,10,False,0,False,False
119,"Phlebotomize","Wounds are bleeding, causing damage over time.",10505,0,2,61,False,False,False,False,False,False,10,False,0,False,False
120,"Power Surge","Damage is increased for next Jump or Spineshatter Dive.",10503,0,1,60,False,False,False,False,False,False,0,False,0,False,False
121,"Disembowel","Piercing resistance is reduced.",13301,0,2,61,False,False,False,False,False,False,50,False,0,False,False
122,"Straighter Shot","Next Straight Shot will result in a critical hit.",10615,0,1,60,False,False,False,False,False,False,0,False,0,False,False
123,"Hawk's Eye","Accuracy is increased and all attacks are guaranteed to land.",10601,0,1,60,False,False,False,False,False,False,0,False,0,False,False
124,"Venomous Bite","Toxins are causing damage over time.",10602,0,2,41,False,False,False,False,False,False,10,False,0,False,False
125,"Raging Strikes","Damage dealt is increased.",10604,0,1,60,False,False,False,False,False,False,0,False,0,False,False
126,"Physical Vulnerability Up","Physical damage taken is increased.",17101,8,2,61,False,False,False,False,False,False,100,False,0,False,False
127,"Quelling Strikes","Enmity generation is reduced.",10605,0,1,60,False,False,False,False,False,False,0,False,0,False,False
128,"Barrage","Striking multiple times per auto-attack.",10606,0,1,60,False,False,False,False,False,False,0,False,0,False,False
129,"Windbite","Wounds are exposed to the elements, causing wind damage over time.",10610,0,2,61,False,False,False,False,False,False,10,False,0,False,False
130,"Straight Shot","Critical hit rate is increased.",10611,0,1,60,False,False,False,False,False,False,0,False,0,False,False
131,"Downpour of Death","Next Rain of Death will not require any TP.",13407,0,1,60,False,False,False,False,False,False,0,False,0,False,False
132,"Quicker Nock","Next Quick Nock will not require any TP.",10612,0,1,60,False,False,False,False,False,False,0,False,0,False,False
133,"Swiftsong","Movement speed of self and nearby party members is increased.",10608,0,1,60,False,False,False,False,True,True,1,True,0,False,False
134,"Swiftsong","Movement speed is increased.",10607,0,1,60,False,False,False,False,False,True,0,True,0,False,False
135,"Mage's Ballad","Using MP to gradually restore the MP of nearby party members. Damage dealt is reduced.",13403,0,1,60,False,False,False,False,True,True,1,True,0,False,False
136,"Mage's Ballad","Restoring MP over time.",13402,0,1,60,False,False,False,False,False,True,0,True,0,False,False
137,"Army's Paeon","Using MP to gradually refresh the TP of self and nearby party members. Damage dealt is reduced.",13405,0,1,60,False,False,False,False,True,True,1,True,0,False,False
138,"Army's Paeon","Regenerating TP over time.",13404,0,1,60,False,False,False,False,False,True,0,True,0,False,False
139,"Foe Requiem","Using MP to lower the elemental resistances of nearby enemies.",13406,0,1,60,False,False,False,False,True,True,0,True,0,False,False
140,"Foe Requiem","All elemental resistances are reduced.",13408,0,2,61,False,False,False,False,False,True,50,True,0,False,False
141,"Battle Voice","The effectiveness of songs is increased.",13401,0,1,60,False,False,False,False,False,False,0,False,0,False,False
142,"Chameleon","All elemental resistances are increased.",10609,0,1,60,False,False,False,False,False,False,0,False,0,False,False
143,"Aero","Taking wind damage over time.",10703,0,2,61,False,False,False,False,False,False,10,False,0,False,False
144,"Aero II","Taking wind damage over time.",10709,0,2,61,False,False,False,False,False,False,10,False,0,False,False
145,"Cleric Stance","INT and MND ratings are swapped, while increasing potency of attack spells and reducing potency of healing spells.",10702,0,1,60,False,False,False,False,True,True,0,True,0,False,False
146,"Protect","Defense is enhanced.",10704,0,1,60,False,False,False,False,False,False,1,False,0,False,False
147,"Protect","Both physical and magic defense are enhanced.",10705,0,1,60,False,False,False,False,False,False,1,False,0,False,False
148,"Raise","Teetering on the brink of consciousness.",10706,0,1,60,False,False,False,False,False,False,100,False,0,False,False
149,"Rebirth","Rebirth",15004,0,2,43,True,True,False,False,False,False,100,False,0,False,False
150,"Medica II","Regenerating HP over time.",10713,0,1,60,False,False,False,False,False,False,5,False,0,False,False
151,"Stoneskin","Lithified flesh is absorbing damage.",10701,0,1,60,False,False,False,False,False,False,30,False,0,False,False
152,"Stoneskin (Physical)","Lithified flesh is absorbing physical damage.",10701,0,1,60,False,False,False,False,True,True,30,False,0,False,False
153,"Stoneskin (Magical)","Lithified flesh is absorbing magic damage.",10701,0,1,60,False,False,False,False,True,True,30,False,0,False,False
154,"Shroud of Saints","Restoring MP over time.",10708,0,1,60,False,False,False,False,False,False,0,False,0,False,False
155,"Freecure","Next Cure II will not require any MP to cast.",10710,0,1,60,False,False,False,False,False,False,0,False,0,False,False
156,"Overcure","Next Cure III will cost half MP.",10711,0,1,60,False,False,False,False,False,False,0,False,0,False,False
157,"Presence of Mind","Spell speed is increased.",13502,0,1,60,False,False,False,False,False,False,0,False,0,False,False
158,"Regen","Regenerating HP over time.",13501,0,1,60,False,False,False,False,False,False,5,False,0,False,False
159,"Divine Seal","The amount of HP restored by healing spells is increased.",10707,0,1,60,False,False,False,False,False,False,0,False,0,False,False
160,"Surecast","Next spell cannot be interrupted by taking damage.",10802,0,1,60,False,False,False,False,False,False,0,False,0,False,False
161,"Thunder","Taking lightning damage over time.",10807,0,2,61,False,False,False,False,False,False,10,False,0,False,False
162,"Thunder II","Taking lightning damage over time.",10808,0,2,61,False,False,False,False,False,False,10,False,0,False,False
163,"Thunder III","Taking lightning damage over time.",10809,0,2,61,False,False,False,False,False,False,10,False,0,False,False
164,"Thundercloud","Next Thunder, Thunder II, or Thunder III will add its full damage over time amount to its initial damage, require no time to cast, and cost no MP.",10811,0,1,60,False,False,False,False,False,False,0,False,0,False,False
165,"Firestarter","Next Fire III will require no time to cast and cost no MP.",10810,0,1,60,False,False,False,False,False,False,0,False,0,False,False
166,"Succor","Next Succor will cost no MP.",13804,0,1,60,False,False,False,False,False,False,0,False,0,False,False
167,"Swiftcast","Next spell will require no time to cast.",10804,0,1,60,False,False,False,False,False,False,0,False,0,False,False
168,"Manaward","An aetherial barrier is preventing all magic damage.",10806,0,1,60,False,False,False,False,False,False,0,False,0,False,False
169,"Manawall","An aetherial barrier is preventing all physical damage.",13601,0,1,60,False,False,False,False,False,False,0,False,0,False,False
170,"Apocatastasis","Fire, ice, and lightning resistances are increased by 30%.",10801,0,1,60,False,False,False,False,False,False,5,False,0,False,False
171,"Ekpyrosis","Unable to receive Apocatastasis.",13602,0,2,61,False,False,False,False,False,False,50,False,0,False,False
172,"Infirmity","Recovering HP at a slower rate.",15531,0,2,61,False,False,False,False,False,False,50,False,0,False,False
173,"Astral Fire","Aetherial balance of mind and spirit is leaning astrally. Fire-aspected spells require more MP, but do more damage. Ice-aspected spells require less MP, but do less damage. MP regeneration has stopped.",10813,0,1,60,False,False,False,False,False,False,0,True,0,False,False
174,"Astral Fire II","Aetherial balance of mind and spirit is leaning astrally. Fire-aspected spells require more MP, but do more damage. Ice-aspected spells require less MP, but do less damage. MP regeneration has stopped.",10814,0,1,60,False,False,False,False,False,False,0,True,0,False,False
175,"Astral Fire III","Aetherial balance of mind and spirit is leaning astrally. Fire-aspected spells require more MP, but do more damage. Ice-aspected spells require less MP, but do less damage, and casting times are halved. MP regeneration has quickened.",10815,0,1,60,False,False,False,False,False,False,0,True,0,False,False
176,"Umbral Ice","Aetherial balance of mind and spirit is leaning umbrally. Fire-aspected spells require less MP, but do less damage. MP regeneration has quickened.",10816,0,1,60,False,False,False,False,False,False,0,True,0,False,False
177,"Umbral Ice II","Aetherial balance of mind and spirit is leaning umbrally. Fire-aspected spells require less MP, but do less damage. MP regeneration has quickened.",10817,0,1,60,False,False,False,False,False,False,0,True,0,False,False
178,"Umbral Ice III","Aetherial balance of mind and spirit is leaning umbrally. Fire-aspected spells require less MP, but do less damage, and casting times are halved. MP regeneration has quickened.",10818,0,1,60,False,False,False,False,False,False,0,True,0,False,False
179,"Bio","Contagions are spreading, causing damage over time.",10904,0,2,61,False,False,False,False,False,False,10,False,0,False,False
180,"Miasma","Lungs are failing, causing damage over time.",10906,0,2,61,False,False,False,False,False,False,10,False,0,False,False
181,"Disease","Movement speed and HP recovered via curing magic are reduced.",15014,0,2,61,False,False,False,False,False,False,100,False,0,False,False
182,"Virus","Motor skills are hampered, causing reduced strength and dexterity.",10910,0,2,61,False,False,False,False,False,False,50,False,0,False,False
183,"Fever","Head is burning, causing reduced mind and intelligence.",10911,0,2,61,False,False,False,False,False,False,50,False,0,False,False
184,"Sustain","Recovering HP over time.",10908,0,1,60,False,False,False,False,False,False,5,False,0,False,False
185,"Eye for an Eye","Chance that next hit suffered will lower the attacker's damage dealt.",10912,0,1,60,False,False,False,False,False,False,30,False,0,False,False
186,"Eye for an Eye","Damage dealt is reduced.",10913,0,2,61,False,False,False,False,False,False,50,False,0,False,False
187,"Rouse","Damage and healing magic potency are increased.",10909,0,1,60,False,False,False,False,False,False,30,False,0,False,False
188,"Miasma II","Contagions are spreading, causing damage over time.",10907,0,2,61,False,False,False,False,False,False,10,False,0,False,False
