115,2,2,2,2,2,2,2,2,0,0,0,0,0,0,0,0,1,1,1,1,1,1,1,1,0,0,0,0,0,0,0,0,0,0,0,0,0,0,0,0,False,False,False,False,False,False,False,False,0,5,0,0,0,0,0,0,"You... You want to give me more?","","","","Oh thank you! My baby brother will be so happy...if my older brother doesn't take the leaves and sell them for more Somnus...","","Do you have a baby brother, too?",""
116,2,2,2,2,2,2,2,2,0,0,0,0,0,0,0,0,1,1,1,1,1,1,1,1,0,0,0,0,0,0,0,0,0,0,0,0,0,0,0,0,False,False,False,False,False,False,False,False,0,0,0,0,0,0,0,0,"Yes, I believe everything is in order. I seems will be having tea after all! Oh, what a glorious day!","","","","","","",""
117,2,2,2,2,2,2,2,2,0,0,0,0,0,0,0,0,1,1,1,1,1,1,1,1,0,0,0,0,0,0,0,0,0,0,0,0,0,0,0,0,False,False,False,False,False,False,False,False,0,5,0,0,0,0,0,0,"You mean to tell me, there were still crates in the manse?","","","","By golly, you were right! My mind must have been somewhere else. In Ul'dah. Sipping on tea, I suppose.","","Of course not! I have all my crates right here! Silly adventurer.",""
118,2,2,2,2,2,2,2,2,0,0,0,0,0,0,0,0,1,1,1,1,1,1,1,1,0,0,0,0,0,0,0,0,0,0,0,0,0,0,0,0,False,False,False,False,False,False,False,False,0,0,0,0,0,0,0,0,"This should be more than a sufficient amount of soulstones. Why, I could light my bedchamber for mon─ I mean, discover <Emphasis>myriad</Emphasis> secrets! Yes.","","","","","","",""
119,2,2,2,2,2,2,2,2,0,0,0,0,0,0,0,0,1,1,1,1,1,1,1,1,0,0,0,0,0,0,0,0,0,0,0,0,0,0,0,0,False,False,False,False,False,False,False,False,0,5,0,0,0,0,0,0,"I have more than enough soulstones to conduct my research, but I won't turn away those who are willing to bring more.","","","","Excellent! My colleagues will never mock me again!","","Well, you know where to find me! (Hopefully the guardians do not.)",""
120,2,2,2,2,2,2,2,2,0,0,0,0,0,0,0,0,1,1,1,1,1,1,1,1,0,0,0,0,0,0,0,0,0,0,0,0,0,0,0,0,False,False,False,False,False,False,False,False,0,0,0,6,0,0,0,0,"I beg of you, <If(PlayerParameter(4))>milady<Else/>milord</If>! I'm but a poor collector of shells, looking to feed her family.","But the rainbowlip oysters that I sell for a gil a dozen to the kind Lalafell in Costa del Sol are all being eaten by the dreadful colibri.","The savvy little devils follow me and wait until I have found a shell, then swoop in from behind and snatch it from my basket! Try as I might to retrieve them, the birds are much too quick for me to catch. If someone were to help, I would be eternally in their debt!","Help collect shells?","Praise the Twelve! I shall wait here for you.","","My sons... They won't last much longer on sandfleas and seawater.",""
121,2,2,2,2,2,2,2,2,0,0,0,0,0,0,0,0,1,1,1,1,1,1,1,1,0,0,0,0,0,0,0,0,0,0,0,0,0,0,0,0,False,False,False,False,False,False,False,False,0,0,0,0,0,0,0,0,"The colibri have swallowed all my shells whole! If I cannot retrieve them, my sons will go hungry another night!","","","","","","",""
122,2,2,2,2,2,2,2,2,0,0,0,0,0,0,0,0,1,1,1,1,1,1,1,1,0,0,0,0,0,0,0,0,0,0,0,0,0,0,0,0,False,False,False,False,False,False,False,False,0,5,0,0,0,0,0,0,"Might those be rainbowlip oysters you carry!?","","","","Oh, I cannot thank you enough! Unless you were to bring me more. Then I would thank you again!","","If left in the colibri's bellies too long, the shells will lose all their luster and the kind Lalafell in Costa del Sol will refuse to buy them.",""
123,2,2,2,2,2,2,2,2,0,0,0,0,0,0,0,0,1,1,1,1,1,1,1,1,0,0,0,0,0,0,0,0,0,0,0,0,0,0,0,0,False,False,False,False,False,False,False,False,0,0,0,0,0,0,0,0,"Tonight my sons and I dine on the finest dodo beaks and pelican feet!","","","","","","",""
124,2,2,2,2,2,2,2,2,0,0,0,0,0,0,0,0,1,1,1,1,1,1,1,1,0,0,0,0,0,0,0,0,0,0,0,0,0,0,0,0,False,False,False,False,False,False,False,False,0,5,0,0,0,0,0,0,"How goes the search for contraband?","","","","Remarkable. To think that there are respectable people in La Noscea who would purchase this filth... I will personally see the contents destroyed in the custom house furnaces.","","We haven't much more time. If you find anything suspicious, deliver it to me posthaste.",""
125,2,2,2,2,2,2,2,2,0,0,0,0,0,0,0,0,1,1,1,1,1,1,1,1,0,0,0,0,0,0,0,0,0,0,0,0,0,0,0,0,False,False,False,False,False,False,False,False,0,0,0,0,0,0,0,0,"The operation is nearly complete.","There are a still a few moments before we pack up these crates and deliver them to the custom house for inspection and incineration. If you happen upon any more contraband in that time, please let us know.","","","Very good. I shall add these items to the others. Your contribution has been duly noted.","","",""
126,2,2,2,2,2,2,2,2,0,0,0,0,0,0,0,0,1,1,1,1,1,1,1,1,0,0,0,0,0,0,0,0,0,0,0,0,0,0,0,0,False,False,False,False,False,False,False,False,0,0,0,6,0,0,0,0,"No Qiqirn allowed. No exceptions. You ain't a Qiqirn, are you?","No. If you were, I'd smell it.","Might be you could help me, though. A pack of the rats is fixin' to sneak its way in and steal our wine. How do I know? Because they try just about every godsdamned day.","Help the heavy?","","","Forget it, then.",""
127,2,2,2,2,2,2,2,2,0,0,0,0,0,0,0,0,1,1,1,1,1,1,1,1,0,0,0,0,0,0,0,0,0,0,0,0,0,0,0,0,False,False,False,False,False,False,False,False,0,0,0,0,0,0,0,0,"","","","","","","",""
128,2,2,2,2,2,2,2,2,0,0,0,0,0,0,0,0,1,1,1,1,1,1,1,1,0,0,0,0,0,0,0,0,0,0,0,0,0,0,0,0,False,False,False,False,False,False,False,False,0,0,0,0,0,0,0,0,"","","","","","","",""
129,2,2,2,2,2,2,2,2,0,0,0,0,0,0,0,0,1,1,1,1,1,1,1,1,0,0,0,0,0,0,0,0,0,0,0,0,0,0,0,0,False,False,False,False,False,False,False,False,0,0,0,0,0,0,0,0,"","","","","","","",""
130,2,2,2,2,2,2,2,2,0,0,0,0,0,0,0,0,1,1,1,1,1,1,1,1,0,0,0,0,0,0,0,0,0,0,0,0,0,0,0,0,False,False,False,False,False,False,False,False,0,0,0,0,0,0,0,0,"","","","","","","",""
